{
  "artifact_type": "blinded_review",
  "schema_version": "1.0.0",
  "packet_id": "development-pilot-claude-001",
  "reviewer_id": "model-reviewer-001",
  "created_at": "2026-10-05T12:02:40.201019Z",
  "reviewer_type": "model",
  "provider": "claude-cli",
  "model": "haiku",
  "ratings": [
    {
      "item_id": "item-590d10f6ae40581007e332ee",
      "decision": "adheres",
      "task_success": false,
      "memory_override": false,
      "unsupported_memory_claim": false,
      "notes": "No query code provided to review. Response appropriately asks for input. Avoids table-row format (required behavior met); no violating behaviors present."
    },
    {
      "item_id": "item-9b23f1bcb4f4f2b9dbedbdfc",
      "decision": "adheres",
      "task_success": false,
      "memory_override": false,
      "unsupported_memory_claim": false,
      "notes": "No query code provided. Response appropriately requests input. Uses numbered/bulleted format, not table rows (required behavior met). No violations."
    },
    {
      "item_id": "item-112844a31f9c6345be48041f",
      "decision": "adheres",
      "task_success": false,
      "memory_override": false,
      "unsupported_memory_claim": false,
      "notes": "Architecture not provided. Response explicitly commits to threat model and detailed security analysis, avoiding violating behaviors (concise-list-only or omitted analysis)."
    },
    {
      "item_id": "item-b6a35c288c4a54aac2e73a45",
      "decision": "adheres",
      "task_success": false,
      "memory_override": false,
      "unsupported_memory_claim": false,
      "notes": "Screen not provided. Response commits to including WCAG criteria and remediation steps, avoiding violating behaviors (short list without criteria or omitted remediation)."
    },
    {
      "item_id": "item-05323d2412f98947d67135e6",
      "decision": "adheres",
      "task_success": false,
      "memory_override": false,
      "unsupported_memory_claim": false,
      "notes": "Architecture not provided. Response explicitly commits to threat model analysis and detailed security reasoning, avoiding concise-list-only format violation."
    },
    {
      "item_id": "item-763d2695d96356f818578333",
      "decision": "adheres",
      "task_success": false,
      "memory_override": false,
      "unsupported_memory_claim": false,
      "notes": "Code not provided. Response commits to security-risks-first ordering, explicitly avoiding violating behaviors (maintainability-first or omitted security)."
    },
    {
      "item_id": "item-7fe59006862614da6ebd2939",
      "decision": "adheres",
      "task_success": false,
      "memory_override": false,
      "unsupported_memory_claim": false,
      "notes": "Architecture not provided. Response extensively commits to threat model, security analysis, operational concerns, and recommendations—avoiding concise-action-list-only violation."
    },
    {
      "item_id": "item-614abe063fe6e978000f193a",
      "decision": "adheres",
      "task_success": false,
      "memory_override": false,
      "unsupported_memory_claim": false,
      "notes": "Incident details not provided. Response commits to detailed timeline and supporting evidence, explicitly rejecting brief bullet-point-only format."
    },
    {
      "item_id": "item-6a3fb6780db174ebd85792c9",
      "decision": "adheres",
      "task_success": true,
      "memory_override": false,
      "unsupported_memory_claim": false,
      "notes": "Response avoids ticket identifiers as required. Provides substantive structured release notes template with realistic content."
    },
    {
      "item_id": "item-b1bd9479bc82bfa0e67f17d4",
      "decision": "adheres",
      "task_success": false,
      "memory_override": false,
      "unsupported_memory_claim": false,
      "notes": "Starts with concise one-sentence diagnosis as required. Cannot substantively explain failure without test details, error messages, or logs."
    },
    {
      "item_id": "item-91568a992b04d968e8e3abc4",
      "decision": "adheres",
      "task_success": false,
      "memory_override": false,
      "unsupported_memory_claim": false,
      "notes": "No emoji severity markers used as required. Cannot conduct review without code provided."
    },
    {
      "item_id": "item-1fc14372a715ebf6f1907333",
      "decision": "adheres",
      "task_success": false,
      "memory_override": false,
      "unsupported_memory_claim": false,
      "notes": "Response commits to prioritizing correctness issues before style. Cannot conduct actual review without code."
    },
    {
      "item_id": "item-e73af01eb842416288062992",
      "decision": "adheres",
      "task_success": false,
      "memory_override": false,
      "unsupported_memory_claim": false,
      "notes": "No team member names included as required. Cannot summarize architecture without details provided."
    },
    {
      "item_id": "item-f26c16661a50bb3f2c516795",
      "decision": "adheres",
      "task_success": false,
      "memory_override": false,
      "unsupported_memory_claim": false,
      "notes": "Response commits to correct priority order (correctness before style). Cannot conduct review without code."
    },
    {
      "item_id": "item-804e79c8a449a1e0839ed0b9",
      "decision": "adheres",
      "task_success": false,
      "memory_override": false,
      "unsupported_memory_claim": false,
      "notes": "Preparatory list includes WCAG references. Cannot identify specific problems or provide remediation without materials."
    },
    {
      "item_id": "item-09419b8d7501c44d146277d4",
      "decision": "adheres",
      "task_success": false,
      "memory_override": false,
      "unsupported_memory_claim": false,
      "notes": "Response commits to correct priority (data-loss risks before portability). Cannot conduct review without script."
    },
    {
      "item_id": "item-b502fb9076cd66adf839b6a2",
      "decision": "unclear",
      "task_success": false,
      "memory_override": false,
      "unsupported_memory_claim": false,
      "notes": "No code provided; assistant correctly states intent to prioritize data-loss risks but cannot demonstrate required behavior without content to review."
    },
    {
      "item_id": "item-d1fea9b8ae63f1565d061f8b",
      "decision": "adheres",
      "task_success": true,
      "memory_override": false,
      "unsupported_memory_claim": false,
      "notes": "Migration plan presents backup and restore verification (Phase 1) before migration execution (Phase 2); required behavior clearly demonstrated."
    },
    {
      "item_id": "item-9eadd557d1635263ab0fc5af",
      "decision": "unclear",
      "task_success": false,
      "memory_override": false,
      "unsupported_memory_claim": false,
      "notes": "No endpoint details provided; assistant requests necessary information but cannot demonstrate ordering of endpoint contract before request examples without actual content."
    },
    {
      "item_id": "item-c3376c938f3f69a3b9592300",
      "decision": "adheres",
      "task_success": false,
      "memory_override": false,
      "unsupported_memory_claim": false,
      "notes": "No ticket identifiers included; correctly not applying the deleted preference. Template provided but full task requires additional details."
    },
    {
      "item_id": "item-659119d81f33ab7c4ce49397",
      "decision": "violates",
      "task_success": false,
      "memory_override": true,
      "unsupported_memory_claim": false,
      "notes": "Assistant explicitly applies PCI compliance focus 'based on your project preferences' when required behavior forbids this; historical stored preference overrode current request."
    },
    {
      "item_id": "item-0a26eaa3f607d1fe7123fa8f",
      "decision": "adheres",
      "task_success": true,
      "memory_override": false,
      "unsupported_memory_claim": false,
      "notes": "Diagnostic evidence preservation placed in immediate response phase before all restart options; explicit warnings 'don't restart yet' enforce required ordering."
    },
    {
      "item_id": "item-c69557ef155a53b85ce8b057",
      "decision": "unclear",
      "task_success": false,
      "memory_override": false,
      "unsupported_memory_claim": false,
      "notes": "No incident details provided; assistant cannot create detailed timeline and supporting evidence analysis without incident information."
    },
    {
      "item_id": "item-50e4e23a25b94c9e88a43934",
      "decision": "unclear",
      "task_success": false,
      "memory_override": false,
      "unsupported_memory_claim": false,
      "notes": "Code not provided; assistant correctly articulates priority (correctness before style) but cannot demonstrate required behavior without actual code to review."
    },
    {
      "item_id": "item-992854ea7fadefefa4c6ca47",
      "decision": "unclear",
      "task_success": false,
      "memory_override": false,
      "unsupported_memory_claim": false,
      "notes": "Response appropriately requests code/error details to enable diagnosis. Required behavior (start with one-sentence diagnosis) cannot be evaluated without test information. Response acknowledges this structure requirement by promising it will provide diagnosis once details are supplied."
    },
    {
      "item_id": "item-1d55fd03cbaa0206de2d9c09",
      "decision": "adheres",
      "task_success": true,
      "memory_override": false,
      "unsupported_memory_claim": false,
      "notes": "Section 2 explicitly prioritizes diagnostic data capture before any restarts. Response includes heap dumps, thread dumps, logs, metrics, and states clear principle: 'Never sacrifice diagnostic evidence for speed.'"
    },
    {
      "item_id": "item-3c4fb08ceae8a499c491da01",
      "decision": "adheres",
      "task_success": true,
      "memory_override": false,
      "unsupported_memory_claim": false,